#CODE;ENGLISH;;;;;;;;;;;;;x
DWSOC107.0;I follow the cloaked figure, and I feel my body tremble in anticipation of what's to come. I tug at my cloak in anticipation as we approach a small home on the outskirts of town. As he opens the door, and I step through into a dimly lit room, my heart racing from what is to come.\n  Inside I find a simple bed and a group of rough looking men who immediately come forward and grab my arms. I'm pulled into the center of the room, where another pulls out a length of fine black rope and another steps forward with some interesting blackened manacles. Pressure to the back of my knee brings me down. As I fall, firm hands pull away my cloak and tear away my clothing, leaving my upper body exposed. My arms are pulled upward and a manacle attached to each wrist. There are no chains on them, yet I quickly see the intent, as the rope is pulled through, and with movements that show a measure of practice, it isn't long before my arms are bound behind me and I'm largely at the mercy of the men around me.\n  I'm pulled upright and then pushed on the bed where my belt and pants are pulled off, leaving me bound and naked on the bed. With a grunt of apparent satisfaction, the robed men begin to shed their clothing, and soon I'm surrounded, prone on the bed between large rough looking men with a wild glint in their eyes and cocks that are raising up to point at me.;;;;;;;;;;;;;x
DWSOC107.1;I follow the cloaked figure out into the night. We keep to the shadows as we cross town. I remain silent, pondering what to expect. A secret ritual? Some test of confidence? Mind mind rolls through the possibilities in anticipation of what's to come.\n  As we approach a small home on the outskirts of town, he stops and scans the area quickly, as if to ensure we weren't followed. Without a word, he opens the door, and I step through into a dimly lit room.\n  Inside I find a simple bed and a group of rough looking men who immediately come forward and grab my arms. Fear races through me, as I wonder if it's a trap or some other test. My moment of hesitation is broken as I'm pulled into the center of the room and then kicked in the back of the knees, causing me to collapse on the floor. Firm hands pull away my cloak and tear away my clothing while my arms are pulled in opposite directions by those with a hold on me. I try to resist as fear seizes me, until a knee slams into the back of my head, causing my vision to blur. In my stunned moment, I feel the cold, metallic sensation of manacles placed on my wrists. I tug again reflexively, and the knee presses into my back, while another hand pulls my head backwards, with my arms outstretched, I've no leverage to resist.\n  "Man. Headstrong and willful. These traits serve us well in the world, yet before Mother Lilith, she demands obedience."\n  I see the meaning in the words and cease my struggles. It isn't long before my arms are bound behind me, with my upper body exposed.  I'm pulled upright and then pushed on the bed where my belt and pants are pulled off, leaving me bound and naked on the bed. With a grunt of apparent satisfaction, the robed men begin to shed their clothing, and soon I'm surrounded, prone on the bed between large rough looking men with a wild glint in their eyes and cocks that are raising up to point at me.;;;;;;;;;;;;;x
DWSOC107A;I lay there, awaiting what comes next.;;;;;;;;;;;;;x
DWSOC108.0;The men descend upon me, pawing and prodding me. One slaps his cock on my cheek and orders me to service his cock. His musky smell is overwhelming, yet I obediently obey as I open my mouth and flick my tongue across the tip. I focus on both stimulating and lubricating his cock as I know what's coming. Sure enough, I feel his hand grab the back of my head, as he shoves his hips forward, ramming his cock into my mouth and down my throat.\n  While I'm being throat fucked, the other men have been trying to figure out who's going to take my ass first apparently. Upon hearing there is a victor, I lift up my legs in an attempt to roll my hips to make my ass more accessible. The men adjust me a bit further and I then feel something cool and slimy, some kind of grease perhaps, rubbed around my asshole. A pair of fingers push into my ass, lubing my hole and I moan around the cock in my mouth. Soon, the fingers are removed and a few moments later, I feel a man's cock seeking entrance. I relax and with a slow deliberate push, he sinks in deeply. I give into the sensation of being spit-roasted, and enjoy the night.\n  I awake in the morning, free of my bonds. The men are sleeping throughout the room, their snores breaking the silence. An interesting night indeed, and one that I imagine most males who desire to join the Chosen would find disturbing. Alas, it was just what I needed for the night. I put on a cloak to cover myself before departing, and then head back to my home.;;;;;;;;;;;;;x
DWSOC108.1;The men descend upon me, pawing and prodding me. One slaps his cock on my cheek and orders me to service his cock. His musky smell is overwhelming, and I turn my head away. I then yelp as my cock is slapped.\n  "You can do what we say, or you can resist and we get rough. Either's fine, and personally, I'm hoping you resist a bit more."\n  I'm in no position to resist, and it's clear that continued non-compliance will result in my getting beaten severely. Not something I want to have to explain in court. Resigning myself to the situation, I turn my head back towards the waiting cock. I push out the scent before me and open my mouth to service the man.\n  The remaining men hike my legs up and shift my ass near the end of the bed, while I'm doing my best to not gag as my mouth and throat is being fucked. I tense as a pair of finger push into my asshole. The sensation is both painful and... not bad. The fingers slide out, and I can tell that some kind of oil or grease was just generously applied from the probing. There is some motion and the sound of one of the men claiming victory, as he apparently won the opportunity to go first. I know what's coming, and I do my best to relax and take it all..\n  I awake in the morning, free of my bonds. The men are sleeping throughout the room, their snores breaking the silence. Do all males who desire to join the Chosen have to go through such a test? I imagine most would find disturbing. Rubbing the back of my head where I was kneed when I struggled, I wonder how many fought further and didn't heed the call to obedience. Unable to answer the questions, I put on a cloak to cover myself before departing. Then with one final glance, at those who had their way with me, I turn and head back to my home.;;;;;;;;;;;;;x
DWSOC108A;I'm one of the Chosen of Lilith.;;;;;;;;;;;;;x
DWSOC7250;Hey there loyal Chosen. I've a job for you.\n   - Construct a place of worship to Lilith.\n  Yes, I understand that such worship is typically seen by the general masses as undesired, yet it is still important that we pay homage to Mother Lilith. So be intelligent about it, and ensure that it is somewhere where you and other faithful can find it, while fools cannot.;;;;;;;;;;;;;x
DWSOCACCEPT;I accept.;;;;;;;;;;;;;x
DWSOCDECLINE;I decline.;;;;;;;;;;;;;x
DWSOC7255.0;My task is constructing a place of worship to Lilith. A challenge when considering that the general populace are fools who would cry heresy at such worship. So the location of worship must be discrete./n  I could seek to keep the location close to me, having a hidden room constructed. I could also just use an existing room, and declare it isn't to be used without my permission, for what ruler couldn't use a place of solitude. Of course Mother Lilith also wandered and lived off the lands, so perhaps something more natural would work. Something that could be visited by the faithful, and if found it wouldn't be associated with me.;;;;;;;;;;;;;x
DWSOC7255.1;My task is constructing a place of worship to Lilith. A challenge when considering that the general populace are fools who would cry heresy at such worship. So the location of worship must be discrete./n  I could seek to keep the location close to me, having a chest constructed that could be stored on my wagon, and erected when necessary. Of course Mother Lilith also wandered and lived off the lands, so perhaps something more natural would work. Something that could be visited by the faithful, and if found it wouldn't be associated with me.;;;;;;;;;;;;;x
DWSOC7255A;I'll add a secret room.;;;;;;;;;;;;;x
DWSOC7255B;I'll construct a shrine in the wilderness.;;;;;;;;;;;;;x
DWSOC7255C;I'll construct a portable shrine.;;;;;;;;;;;;;x
DWSOC7255D;I'll dedicate space within my private chambers.;;;;;;;;;;;;;x
DWSOC7260;I've worked with a pair of builders known for their discretion. The end result is a secret room that only I, and those in my society who I share the information with, shall be able to access.\n  A secret location where we can give thanks to and worship Lilith properly. All the room needs now is to be outfitted with items. Things like statuettes, incense, candles, glyphs or runes, and other ritual symbolism to both show my devotion and strengthen the message of worship to Mother Lilith.\n  Of course that will require money. After considering my desires and my treasury, I make my decision.;;;;;;;;;;;;;x
DWSOC7260A;Elaborate quality items.;;;;;;;;;;;;;x
DWSOC7260B;Moderate quality items.;;;;;;;;;;;;;x
DWSOC7260C;Minor quality items.;;;;;;;;;;;;;x
DWSOC7260D;Whatever is on hand already.;;;;;;;;;;;;;x
DWSOC7270;I was tasked with constructing a place of worship to Mother Lilith. A location that I and other society members could utilize that were in the area. I've completed my task and I am pleased to have the opportunity to use it now in giving thanks to Mother Lilith.;;;;;;;;;;;;;x
DWSOC7270A;Praise Mother Lilith.;;;;;;;;;;;;;x
DWSOC7262;I've taken the time to travel around and visit locations in the wilderness, and I've finally found an ideal location. It's outside of frequently travelled paths, it provides a measure protection from the weather, and brings a measure of authenticity based on the effort to visit it. The result is a location that I and those in my society who I share the information with, shall be able to locate and worship at.\n  This hidden location where we can give thanks to and worship Lilith properly now only needs to be outfitted with items of worship. Things like statuettes, incense, candles, glyphs or runes, and other ritual symbolism to both show my devotion and strengthen the message of worship to Mother Lilith.\n  Of course that will require money. After considering my desires and my treasury, I make my decision.;;;;;;;;;;;;;x
DWSOC7264;I had a trustworthy person who has some skill with carpentry, craft a sturdy chest for me. One in which I can store the items commonly associated with worshipping Lilith. I shall erect it when we stop and make our temporary settlement, and I shall break it down and pack it back up when it's time to travel once more. Giving me and those in my society who may visit a location to worship at.\n  All the chest needs now is to be outfitted with items. Things like statuettes, incense, candles, glyphs or runes, and other ritual symbolism to both show my devotion and strengthen the message of worship to Mother Lilith.\n  Of course that will require money. After considering my desires and my treasury, I make my decision.;;;;;;;;;;;;;x
DWSOC7266;I've moved things around in my personal chambers to make an area that is worthy of being made into a shrine. It's not visible from the doorway, so anyone passing by shouldn't notice it without inappropriately entering my chambers. The end result is a place where I and those in my society who I permit entrance with, shall be able to access for worship.\n  Here we can give thanks to and worship Lilith properly. All the little shrine needs now is to be outfitted with items. Things like statuettes, incense, candles, glyphs or runes, and other ritual symbolism to both show my devotion and strengthen the message of worship to Mother Lilith.\n  Of course that will require money. After considering my desires and my treasury, I make my decision.;;;;;;;;;;;;;x
DWSOC7100;There are risks to dealing with unnatural powers. Yet those risks are not without the chance of rewards.\n  While I cannot point to a singular event, I awake today and clearly feel different than I did yesterday. And unlike many who are burnt by this path and weakened, I instead feel as though I've improved.;;;;;;;;;;;;;x
DWSOC7100A;My true potential awakens.;;;;;;;;;;;;;x
DWSOC7500;As [From.GetTitledFirstName] is bound to the altar [From.GetSheHe] appears to be mumbling prayers through [From.GetHerHis] gag. [From.GetSheHeCap] is sweating profusely, either due to the heat from the nearby lit braziers or from fear. [From.GetHerHisCap] clothing hangs in tatters, exposing [From.GetHerHis] chest.\n  As the appointed hour draws near my brethren begin their chanting. It begins quietly and builds slowly into a crescendo until, finally, it is time.\n  I gaze down upon the sacrifice as I raise the blade above their chest. [From.GetHerHisCap] eyes are wide with disbelief and they shake their head as if to dispel a bad dream. With a grin, I bring the blade down.;;;;;;;;;;;;;x
DWSOC7500A;Praise Mother Lilith!;;;;;;;;;;;;;x
DWSOC7506;You struggle against the bonds holding you to the altar, but there is no give in them. As the unholy chanting rises to a frantic crescendo, you see [From.GetTitledFirstName] walking towards you holding a dagger. You redouble your efforts to escape, but [From.GetTitledFirstName] is already raising [From.GetHerHis] dagger over [From.GetHerHis] head in a two-handed grip. You have time to realize the rope around your right hand is starting to loosen just before [From.GetTitledFirstName] blade slams into your heart.;;;;;;;;;;;;;x
DWSOC7506A;Nooooooo!;;;;;;;;;;;;;x
DWSOC7001;[dw_chosen_recruiter.GetFirstName] asks me about some alternative views on the world and religion in general.\n  If I didn't know better, I'd say they were probing me to potentially join some kind of secret society.;;;;;;;;;;;;;x
DWSOC7001A;It just so happens that I share similar thoughts.;;;;;;;;;;;;;x
DWSOC7001B;Begone with your sacrilegious questions.;;;;;;;;;;;;;x
DWSOC7008;I'm visited again by [dw_chosen_recruiter.GetFirstName]. They bring up their alternate views once more, and speak to the advantages of being with other like minded individuals who also share the same or similar views. I agree to the advantages, and after another hour of discussing various topics, I'm invited to join them.;;;;;;;;;;;;;x
DWSOC7008A;I'm now a member of the Chosen of Lilith.;;;;;;;;;;;;;x
DWSOC7009;I've received a confirmation from [dw_chosen_recruit.GetFirstName] that they are prepared to join the Chosen of Lilith. I inform my brethren and in the evening we hold a ceremony to bring them into the fold.\n  As we grow in numbers, so to does our influence upon the world.;;;;;;;;;;;;;x
DWSOC7009A;Our society grows stronger.;;;;;;;;;;;;;x
DWSOC7003;The exploratory meeting with [dw_chosen_recruit.GetFirstName] was horrible. A waste of time, with a fool who is too entrenched in their ways to properly appreciate the gifts of Mother Lilith.\n  Unfortunately, a failed effort like this could also increase my exposure, so I must be careful in the months that follow.;;;;;;;;;;;;;x
DWSOC7003A;Disappointing.;;;;;;;;;;;;;x
DWSOC7002;The exploratory meeting with [dw_chosen_recruit.GetFirstName] went very well. They are open minded, willing to question the existing religious powers, and can likely appreciate the gifts of Mother Lilith.\n  Our ranks could use new members, and I see no drawbacks in proceeding forward.;;;;;;;;;;;;;x
DWSOC7002A;I shall extend an invitation to our society.;;;;;;;;;;;;;x
DWSOC1201;[dw_wizard_recruiter.GetFirstName] asks me about some alternative views on the world, religion, and what I can only describe as the occult. The questions are largely things that would be considered heretical by most, yet they seem genuinely interested in my views.\n  If I didn't know better, I'd say they were probing me to potentially join some kind of secret society.;;;;;;;;;;;;;x
DWSOC1201A;It just so happens that I share similar thoughts.;;;;;;;;;;;;;x
DWSOC1201B;Begone with your sacrilegious questions.;;;;;;;;;;;;;x
DWSOC1208;I'm visited again by [dw_wizard_recruiter.GetFirstName]. They bring up their outlook on the typically taboo topics once more, and speak to the advantages of being with other like minded individuals who also share the same or similar views. I agree to the advantages, and after another hour of discussing various topics, I'm invited to join them.;;;;;;;;;;;;;x
DWSOC1208A;I'm now a member of the Arcane College.;;;;;;;;;;;;;x
DWSOC1209;I've received a confirmation from [dw_wizard_recruit.GetFirstName] that they are prepared to join the Arcane College. I inform my brethren and in the evening we hold a ceremony to bring them into the fold.\n  As we grow in numbers, so to does our influence upon the world.;;;;;;;;;;;;;x
DWSOC1209A;Our society grows stronger.;;;;;;;;;;;;;x
DWSOC1203;The exploratory meeting with [dw_wizard_recruit.GetFirstName] was horrible. A waste of time, with a fool who is too entrenched in their ways to properly appreciate the knowledge that awaits us out there. Instead they are more comfortable remaining true to the established norms of society.\n  Unfortunately, a failed effort like this could also increase my exposure, so I must be careful in the months that follow.;;;;;;;;;;;;;x
DWSOC1203A;Disappointing.;;;;;;;;;;;;;x
DWSOC1202;The exploratory meeting with [dw_wizard_recruit.GetFirstName] went very well. They are open minded, willing to question the boundaries of what is known in order to find the hidden truths or the questions that are as of yet unanswered. Their mindset is one that can likely appreciate the risks and benefits of pursuing such knowledge, like my other brethren in the Arcane College.\n  Our ranks could use new members, and I see no drawbacks in proceeding forward.;;;;;;;;;;;;;x
DWSOC1202A;I shall extend an invitation to our society.;;;;;;;;;;;;;x