#CODE;ENGLISH;;;;;;;;;;;;;x
dw_wizardtower01;I enter the Wizard Tower where I find it's ever vigilant keeper waiting for me.\n  "Good day [ROOT.GetTitledFirstName], the crow spoke of your approach. What may I assist you with this day?"\n\n If my learning is high enough, then I can seek training to become a mage myself, or to unlock a casting specialization.\n  If I've some coin available, I can take a look at their various wares they offer.\n  Another option with some coin is to obtain an arcane practitioner for my court.;;;;;;;;;;;;;x
dw_wizardtower01a;I'm here to learn;;;;;;;;;;;;;x
dw_wizardtower01b;I'm here to shop;;;;;;;;;;;;;x
dw_wizardtower01c;I'm here to recruit;;;;;;;;;;;;;x
dw_wizardtower01d;Nevermind;;;;;;;;;;;;;x
dw_wizardtower100;I make my way to the second level of the tower, where I meet the wizard that is responsible for arranging the recruitment of trained magic users. Most such arrangements are temporary, job specific contracts. However, as the ruler of these lands, I've the opportunity for a long term recruitment where I can add the individual to my court.\n  The mage responsible pours over his parchments to see who's ready for recruiting. After several minutes, he shares what's available for me to make my choice.;;;;;;;;;;;;;x
dw_wizardtower100a;Random recruit.;;;;;;;;;;;;;x
dw_wizardtower100b;Recruit Scarlet Witch;;;;;;;;;;;;;x
dw_wizardtower100c;Recruit Raven;;;;;;;;;;;;;x
dw_wizardtower100d;Recruit Hermione;;;;;;;;;;;;;x
dw_wizardtower100e;Recruit Sorcey;;;;;;;;;;;;;x
dw_wizardtower100end;Nevermind.;;;;;;;;;;;;;x
dw_wizardtower101;I select the Scarlet Witch. I follow the recruiter to where she is presently training.\n  She's clearly surrounded with an impressive aura, as she's going through a series of complex hand motions. Noticing us, she gives a chant and alters her movements, causing the power she built up to slowly recede.\n  She looks from the recruiter to me. "It is a pleasure to meet the ruler of these lands. I'm Wanda Maximoff, although most around here refer to me as the Scarlet Witch."\n  We have a very interesting chat. I get the impression that her morale compass is a little fluid. I definitely get the impression that it'd be better to be on her good side than her bad side. Alas, she seems to have no issues with me during our discussion, and she indicates that she'll follow my lead and seek to be a reliable contributor to my goals.;;;;;;;;;;;;;x
dw_wizardtower101a;Welcome to my court.;;;;;;;;;;;;;x
dw_wizardtower101b;Go experience the world (Banish);;;;;;;;;;;;;x
dw_wizardtower101c;Begone forever (Vanishes);;;;;;;;;;;;;x
dw_wizardtower102;I select the one called Raven. I follow the recruiter to a dark room, heavy in shadows save for light that spills in from an open window. There is a flash of light, followed by billowing smoke which roils about the room. At the edge of smoke and light, I see a dark clad figure. For just a moment, it seemed as though the smoke took the shape of wings, which disperses as the person notices us.\n  Approaching us, I see that the dark clothed figure is a young woman. She looks between the recruiter and I, and then gives a nod of acknowledgement.\n  "I am called Raven. If you wish my birth name, it is Rachel Roth. I assume I am now in your employ."\n  She's short on words, clearly not one fond of speaking. Still, her quiet bearing doesn't seem to be due to shyness, as she seems confident in herself based on her posture. Perhaps she's simply more humble than shy.\n  She begins tapping her foot, so patience isn't a strength of hers. Then again, I've not yet responded to her, so I guess I should stop with my silent assessment.;;;;;;;;;;;;;x
dw_wizardtower102a;Welcome to my court.;;;;;;;;;;;;;x
dw_wizardtower102b;Go experience the world (Banish);;;;;;;;;;;;;x
dw_wizardtower102c;Begone forever (Vanishes);;;;;;;;;;;;;x
dw_wizardtower103;I select the one called Hermione, who I understand is a young mage who just completed her schooling. \n  I follow the directions up a spiraling staircase to a room with a young woman in the middle of it. She's starring intently at a book, silently mouthing something as though to get it's pronunciation correct. With the resolve apparent in her eyes, she quickly utters a string of arcane words and then with a flourish of her wrist and the wave of a wand, the smoke in the room forms the image of a cat that bounds around briefly before dissipating.\n  A smile beams on her face, until she finally notices me. It quickly disappears as she puts on a more serious and disciplined personae.\n  "Greetings [ROOT.GetTitledName]. Is there something I can assist you with?"\n  While she seeks to subdue it, I can almost see the excitement within her, clearly hoping my visit involves her and not simply directions to find another.;;;;;;;;;;;;;x
dw_wizardtower103a;Welcome to my court Hermione.;;;;;;;;;;;;;x
dw_wizardtower103b;Go experience the world (Banish);;;;;;;;;;;;;x
dw_wizardtower103c;Begone forever (Vanishes);;;;;;;;;;;;;x
dw_wizardtower104;Having chosen to recruit the mage known as Sorcey, I follow the directions up a spiraling staircase to a room with a woman seated on a large chair. She seems to be holding a one-sided conversation with a skull she is holding, when she stops and looks in my direction.\n  "Why hello [ROOT.GetTitledFirstName]. I'm Sorcey, and assuming you're looking for me, then just say the world and I'm more than ready to join your court."\n  I ask her why she would assume I'm there to invite her to court, and with a little pout, she mentions that no one seems to ask her for anything. Not even directions, so if I'm here, surely it's to recruit her.\n  Of course, that was my original intention as I walked up the stairway to come to this room.;;;;;;;;;;;;;x
dw_wizardtower104a;Welcome to my court Sorcey.;;;;;;;;;;;;;x
dw_wizardtower200.0;I make my way through the tower until I come across a small room that is filled with books, scrolls, and an assortment of objects that seem to range from the mundane to arcane. In the middle of the room is an elderly dwarven woman, with a winged serpent perched upon her shoulder. Upon noticing me, she gives me a grin and taps her staff cane excitedly on the ground.\n  "By the grace of Hermes, I never expected to see [ROOT.GetTitledFirstName] enter my humble classroom. I'm Drudga. What can I do for you?"\n  I explain that I'm interested in learning how to wield the mysterious magical energies that exist within this world. With this, the elderly dwarf looks me over with earnest. Clearly evaluating me.\n  "Very well, I can show you the basics. It's not quick. Most take about a year, some sooner, others longer. Once done, you'd be a mage. Be aware, it's only the beginning. There are specializations that you'd then likely want to follow-up on. In order to learn different spells.";;;;;;;;;;;;;x
dw_wizardtower200.1;I make my way through the tower, back to the small room of my first instructor, Drudga. Upon entering, I find her there, looking the same as always.\n  "Welcome [ROOT.GetTitledFirstName], I am honored to see you here today as a fellow arcane user. Is there a new path of knowledge that I can point you towards?"\n  Transmutation Specialists use magic that remakes an object. Evocation Specialists manipulate energy with explosive results and are commonly employed as Battle Mages. Necromancers specialize in magic related to the dead. Summoner Specialists use complex rituals to call forth beings from elsewhere.\n  Training time for each is similar to the time investment of mage training that you've completed (roughly a year).;;;;;;;;;;;;;x
dw_wizardtower200a;I'm ready to start.;;;;;;;;;;;;;x
dw_wizardtower200b;Transmutation Training.;;;;;;;;;;;;;x
dw_wizardtower200c;Evocation Training.;;;;;;;;;;;;;x
dw_wizardtower200d;Necromancy Training.;;;;;;;;;;;;;x
dw_wizardtower200e;Summoning Training.;;;;;;;;;;;;;x
dw_wizardtower200end;I've nothing left to learn.;;;;;;;;;;;;;x
dw_wizardtower201;My elderly dwarven instructor calls out what largely seems like random titles out into the air. I hear some shuffling from behind the shelves and soon a young woman appears with a stack of books and scrolls.\n  "Here dearie, please give the items to [ROOT.GetTitledFirstName]."\n  I accept the materials and the young woman gives a small curtesy before excusing herself.\n  "A good young lass she is. A fair amount of potential herself. Like you, she's in training, yet without a place to call home, she stays here. You meanwhile, are of course free to do your reading and training where you please. Difference in status and all. Just remember, most take about a year, others less, others more. Stay your course, and you'll be a mage in the end."\n  I listen as she goes over the order of material, and a variety of other advice. Then with little more to add, she finally nods and let's me know that she's no more to share today.;;;;;;;;;;;;;x
dw_wizardtower201a;Thank you.;;;;;;;;;;;;;x
dw_wizardtower202;I've made it through much of the introductory theories of magic, and am now ready for the next stage where I shall begin to learn how to control the arcane energies within the world. Based on what my arcane instructor has shared with me, I've just completed the first third of the journey. The next third is a risky one, where those who've pressed to quickly have suffered mishaps.\n  Do I push myself to bring a quicker resolution to my training, or shall I stay the course?;;;;;;;;;;;;;x
dw_wizardtower202a;I shall stay the course.;;;;;;;;;;;;;x
dw_wizardtower202b;I shall push myself.;;;;;;;;;;;;;x
dw_wizardtower202c;What's the hurry?;;;;;;;;;;;;;x
dw_wizardtower203;I have advanced my understanding of the arcane to the stage where I can focus the energies within my hands. When I focus enough, I can even see the energies taking shape, akin to a ball of wispy energy.\n  The next stage in my training is the last third. At it's completion I will be a mage with a foundation in controlling magical energies that can be formed into spells. This next stage is more risky than the last one to try and speed through, yet the allure of achieving my end goal sooner rather than later is awfully appealing.;;;;;;;;;;;;;x
dw_wizardtower204;I've made it. After having displayed my knowledge and control in front of Drudga and several other mages of the Wizard's Tower, I've been declared a mage myself.\n  I can now shape the arcane energies around me and cast spells.\n\n  NOTE: In an attempt to simplify things, I'm just going to use spell cooldowns instead of having a mana or other value to track. The more powerful the spell, the longer its cooldown. There is a potion the Wizards Tower sells on occasion, a Mana Potion, that when consumed will remove any cooldown effects that are in place.;;;;;;;;;;;;;x
dw_wizardtower204a;I am now a mage.;;;;;;;;;;;;;x
dw_wizardtower210;I follow Drudga's directions and come to a small room where an elderly dwarf is observing a raven haired woman who is standing within a cauldron covered with arcane symbols. The dwarven man notices me and then turns his attention back towards the woman.\n  "Welcome Magus [ROOT.GetFirstName]. My potions are sold in the shop, unless you're hear for another reason. If that's the case, how may I, Brindleburg, be of assistance?."\n  I state my desire to be trained further in transmutation magic. Brindleburg pauses for a moment. Then he taps his head with a flask he's holding and pours some of its contents into the cauldron. After staring intently at the smoke that rises, he turns and makes some notes in a tome.\n  "One who specializes in transmutations must be ready for a lot of lab work. I'll not teach you how to make potions, yet instead how to understand the magic we use as part of the process. Of course, you'll learn new spells. Still interested?";;;;;;;;;;;;;x
dw_wizardtower210a;I'm ready to start.;;;;;;;;;;;;;x
dw_wizardtower211;I've reached the first milestone of my training according to my Transmutation instructor Brindleburg. These months have been filled with learning just as much about the mundane world, as it has been about magic. I understand now that in order to better transmute something, that the greater the knowledge of something, the easier it is to change it with magic.\n  The next stage of my training will involve experimentation. I could always push things, but of course that carries risks, while staying the course is definitely the safer path to take.;;;;;;;;;;;;;x
dw_wizardtower212;My Transmutation Instructor, Brindleburg, has informed me that he feels I've reached the second milestone of my training. After months of experimentation where I saw things go both better than expected and worse than I had imagined, I'm finally ready for the next stage. This final stage is the last leg of the journey in becoming a Transmutation Specialist.\n  I'll be learning how to formulate and cast proper transmutation spells. The end of the road is almost in sight. Do I push the boundaries recommended by my instructor, or do I stay the course?;;;;;;;;;;;;;x
dw_wizardtower213;I've achieved my goal. Having completed the third stage, I stood before and was evaluated by my Transmutation Instructor, Brindleburg. A man who is usually observing and commenting on areas of improvement, he's always been short on any kind of praise. Yet with my work done, he flashes the first smile I've seen from him.\n  "It's been a journey, and at times I admit I wondered if you endure it, yet here you are. Well done. I don't like to apply ranks to people, yet I feel it only fair to say that you've ended up being one of my more memorable students. May your education never end and secrets unfold before you.";;;;;;;;;;;;;x
dw_wizardtower213a;I'm a Transmutation Specialist;;;;;;;;;;;;;x
dw_wizardtower220;I follow Drudga's directions, and finally find myself in a chamber where an elven woman is standing in the middle of the room, with three balls of fire slowly rotating about her. She notices me and with a soft smile and a wave of her hand, the firey globes dissipate one after another.\n  "Ah, you're one of our fellow mages, [ROOT.GetFirstName]. Are you here for a visit? No? Oh, do you seek training? I do so enjoy training others in the joys of evocation."\n  I confirm that yes, I'm indeed here to receive training. The woman then introduces herself as Aelwyn. She then explains that what I walked in on is very much what I'll be doing the first part of my training. Which is to sense and focus on gathering different types of energy. It's a bit more meditative than other paths, with less tome studying until the later stages.;;;;;;;;;;;;;x
dw_wizardtower221;I've achieved the first milestone in my training Evocation magic with Aelwyn. She has expressed satisfaction at my ability to meditate and pull the various magical energy that exists around me, into condensed forms which can then be tuned towards specific elements.\n  It was after performing such an excercise and shaping the energy into spheres of intense heat and chilling cold, that she declared my knowledge sufficient to advance to the next stage.\n  The next stage involves projecting such energies, similar to the ability to project arcane energy that I learned as a mage, yet this time infused with an elemental component.\n  She does warn me about trying to push myself too quickly. More than one student has set themselves on fire, a most unpleasant experience.;;;;;;;;;;;;;x
dw_wizardtower222;I've reached the second milestone. Aelwyn observed my control in being able to call forth elemental based arcane energy and project it with stunning results. The exercise left me fatigued and with the hint of a headache, yet Aelwyn's excitement at what I accomplished managed to still bring a smile to my face.\n  This past stage will help me greatly in self defense (GAME NOTE: To be reflected in the Combat Rating buff given by the Evocation Specialist modifier given at the end of training), the next stage will have me learning some of the most dangerous spells known. Pushing ahead of schedule can be life threatening if I make a mistake. I should choose how I progress with some careful consideration.;;;;;;;;;;;;;x
dw_wizardtower223;I've successfully completed my Evocation Specialist training. It was an exhilarating experience with fire, frost, and lightning galore. I can see why people fear mages, just based on the sheer destructive capability we can wield.\n  Aelwyn also showed a side of her I never really noticed. She seemed like a very level headed elven woman, yet ask I called forth spell after spell, there was a glint in her eyes that made me wonder how close she was to being lost to the feeling of power that come with wielding such forces. If anything, I made the mental note to stay on her good side.;;;;;;;;;;;;;x
dw_wizardtower223a;I'm an Evocation Specialist;;;;;;;;;;;;;x
dw_wizardtower224;I've made a grave mistake. I was working on sensing and focusing the energy around me as I wandered to the market today. The sun was shining bright and I could almost feel it's rays of light aiding my training.\n  Then, before I knew it, flames were rippling out from my body. My concentration broke, and the flames rolled away from my like a wave, striking nearby buildings.\n  Luck was not with me at that moment, as the buildings caught fire. Efforts quickly mobilized, yet a building was lost, and I can only attribute it to my being aggressive with my training.;;;;;;;;;;;;;x
dw_wizardtower224a;I must be more careful;;;;;;;;;;;;;x
dw_wizardtower225;I've made a grave mistake. I was working on sensing and focusing the energy around me as I wandered to the market today. The sun was shining bright and I could almost feel it's rays of light aiding my training.\n  Then, before I knew it, flames were rippling out from my body. My concentration broke, and the flames rolled away from my like a wave, striking nearby buildings.\n  Luck was not with me at that moment, as the buildings caught fire. Efforts quickly mobilized, yet a building was lost, and I can only attribute it to my being aggressive with my training.;;;;;;;;;;;;;x
dw_wizardtower225a;I must be more careful;;;;;;;;;;;;;x
dw_wizardtower230;I follow Drudga's directions, which lead me to subterranean levels of the Wizard Tower. There, in an area that is cool, with the smell of death and preserves in the air, I find my objective. A man, his skin as pale as death, who is cloaked in attire of leathers and bone stands before me.\n  "I am Threzenoth. I've been expecting you [ROOT.GetTitledFirstName]. I understand you're now a fellow mage, and as one, I imagined it'd only be a matter of time before interest in my arts called out for you to seek for me."\n  Not exactly what I was expecting. Shrugging off his arrogant prophetic statement, I confirm that I'm indeed interested in learning Necromancy.\n  "Very good. These coming months shall expose you to many things. Your knowledge of the dead shall reach new heights."\n  I spend the rest of today listening to my new instructor speak highly of himself and how he'll make me great. At the end, I finally receive my first material to study, and I begin my journey.;;;;;;;;;;;;;x
dw_wizardtower231;I've reached the first milestone in my necromancy training. Threzenoth has had me dissect and work with a variety of beast corpses, as they're usually less willful than the corpses of more intelligent beings. It has been very eye opening. How some vessels are nothing more than decaying flesh and bone, while others leave behind remnants of spiritual energy that can be interacted with.\n If there is a downside to my training so far, it's been several folks asking if I'm okay, for my skin has already begun to pale. While I thought Threzenoth simply didn't see the light of day, perhaps the effect on one's skin has more to do with the energies that we interface with.\n  As it is, the next stage of training will involve working with more advanced corpses. Those of humans and other intelligent species. Threzenoth never mentioned the risks of pushing forward too quickly, but it's safe to assume that there are risks by hurrying.;;;;;;;;;;;;;x
dw_wizardtower232;I've passed my second milestone. Threzenoth may be arrogant and short with the information he provides, but the key is not getting hung up on such trivial things. He expects his students to be intelligent and to find the answers among the hints he provides.\n  I'm now able to sense and pull residual energy left behind from the dead of humans and other intelligent species. Even a corpse that is decades old can harbor a hint of its former spirit.\n  The final stage that I am starting, shall be using these energies to formulate spells. Spells that are not viewed favorably by the inhabitants of the world. Regardless, I didn't choose to follow this path for the purpose of popularity.;;;;;;;;;;;;;x
dw_wizardtower233;My work is complete. I've stood before Threzenoth in a graveyard and called forth the bodies of the dead to heed my call. With this display of necromancy control, Threzenoth declared that I have completed my training.\n  I can see how one could adopt an air of arrogance, as the ability to call forth and work as the puppeteer over such soulless constructs gives one an amazing feeling of power. As though death itself would bend to our will.;;;;;;;;;;;;;x
dw_wizardtower233a;I'm a Necromancy Specialist;;;;;;;;;;;;;x
dw_wizardtower240;I follow Drudga's instructions and ascend within the tower until I come to a chamber that is filled with a variety of arcane symbols. In the center of the room, sits, or rather floats a man in the center of a circle that is awash with arcane energy. I wait patiently and after a bit, the man opens his eyes and addresses me.\n  "Ah, welcome [ROOT.GetTitledFirstName], my mage brother. What may I, Shaleesh, do for you this blessed day?"\n  I explain my desire to learn more about summoning, and that I understand it is his specialty as an instructor. He grins and steps forward, taking my hand in a firm grasp.\n  "I, Shaleesh, welcome the opportunity to train you."\n  He then pulls out some tomes and hands them to me, along with some vials. He says that the first part of my training is learning the symbolism involved in safely summoning beings. I nod in understanding and leave with my materials.;;;;;;;;;;;;;x
dw_wizardtower241;I've reached my first milestone in becoming a Summoning Specialist. I've learned such a variety of symbols and various means for making them, along with what ingredients to use in candles, inks, or the like. All of which depends on the type of symbol being used.\n  My first stage came to its completion in Shaleesh's eyes when I was able to craft a symbol, and then infuse it with a magical aura from special candles I had also crafted.\n  The next stage of the training is one of the more dangerous according to Shaleesh, as it will involve learning how to communicate through such symbols. Much like he was when I met him, one can apparently use symbols to speak to other beings from beyond. Many of which would seek to do me harm.\n  So the dangers are clear, as I decide if I shall stay the course or risk pushing ahead faster. ;;;;;;;;;;;;;x
dw_wizardtower242;I've reached my second milestone under Shaleesh's tutelage. I have successfully protected myself and communed with beings from beyond. As part of a test, Shaleesh left a message for me to locate with a denizen of the underworld. It was quite the challenge, as the one holding his message wasn't willing to give it freely, yet I managed to obtain it without giving anything of worth.\n  Shaleesh was pleased, and said that it was time for the final stage, where I shall learn various spells. And while I've shown the ability to communicate and not fall prey to other worldly beings, I shouldn't take them for granted, as they will seek to strike if I lessen my guard. This next stage is even more dangerous, as it could involve physical manifestations.;;;;;;;;;;;;;x
dw_wizardtower243;I've completed my training in Summoning. With Shaleesh observing, I went through the steps of crafting a circle, empowering it, and then communicating with a creature from beyond our realm before calling them forth into it.\n  I choose a Succubus at Shaleesh's recommendation, as it provides a fair challenge in terms of control. Largely because of it's unnatural ability to entice and lure beings to it. It seemed more than a little disappointed when Shaleesh signaled that we were done and I dismissed it back to its realm.\n  "You've done quite well [ROOT.GetTitledFirstName]. I've nothing else I teach you. Congratulations in achieving something that many do not.";;;;;;;;;;;;;x
dw_wizardtower243a;I'm a Summoning Specialist;;;;;;;;;;;;;x
dw_wizardtower244;I've made a foolish mistake. In striving to push forward, an oversight had me not communing with one being from beyond, but several. Worse, they're demons, the kind that specialize in chipping away at one's mind until they can establish a foothold.\n  I quickly fell back on my training and sought to no longer interact with them, but to instead bolster my own resolve. Still regardless of my focus, they where there. Chipping away slowly at my resolve.\n  When I was uncertain how much longer I could hold out, I was saved. Shaleesh came to check on my progress and found my state. After sealing the off their voices, he helped coax me back to a proper mind set.\n  Seeing I was safe at last, he admonished my reckless action and warned that lunacy or worse could have befallen me.\n  Not wishing a repeat, I took a much more cautious approach for the rest of this stage.;;;;;;;;;;;;;x
dw_wizardtower244a;I shall be more careful.;;;;;;;;;;;;;x
