#CODE;ENGLISH;;;;;;;;;;;;;x
dw_wizardtower5251;It's late and I'm in the mood to roam, so I find myself wandering the halls of my estate. While walking through the basement area, I hear an odd moan, and being curious I follow it to find Hermione sitting in an arcane circle. \n  I can see by the lantern light that she is squirming, looking confused as if trying to figure out a problem. Her body's actions don't match the confusion on her face as she allows her blouse to fall off her shoulders and reveal a glimpse of her breast, while a hand traces softly along her leg. \n  "Hermione, are you alright?" \n  Her eyes seem to struggle to focus on me. "My body... The spell... I feel my inhibitions being stripped away. The circle... you must break it... or I won't be able to stop myself." \n  As if to accentuate the point, I watch as her hand traces up her thigh and a moan escapes her lips. ;;;;;;;;;;;;;x
dw_wizardtower5251A;I break the boundary of the circle to free Hermione.;;;;;;;;;;;;;x
dw_wizardtower5251B;Intrigued, I let the spell complete changing Hermione.;;;;;;;;;;;;;x
dw_wizardtower5252.0;After breaking the circle that was tearing away at Hermione's mind, she collapsed and had to be carried to her bed. She slept soundly through the night and through most of the following day. \n  When I next saw her, she had an energy about her and her eyes looked deeply into mine. "I appreciate your saving me my [Root.GetLordLady]. I was foolish to experiment with such magic, without adequate means to handle a problem. I can only imagine what would have happened if you didn't save me. It could have cost me my magical abilities entirely." \n  After a few questions, I learn that she was trying to interpret an arcane tome that she had found. And apparently the magic is meant to strip away one's inhibitions, leaving them filled with lust. Hermione now feels she can do the opposite with her magic, the ability to remove lustful or hedonistic thoughts from a person should I wish it. In fact, she believes she can make a normal person become chaste, and a chaste one celibate. \n  I just need to point her towards the desired target, and if I have the energy (piety) necessary to draw upon, she'll make it happen. \n  "Please know that what you did for me has my gratitude, and should you wish it, I'd be honored to be your love. For you've shown to be one who respects and appreciates who I am.";;;;;;;;;;;;;x
dw_wizardtower5252.1;After breaking the circle that was tearing away at my love's sensibility, she collapsed and had to be carried to her bed. She slept soundly through the night and through most of the following day. \n  When I next saw her, she had an energy about her and her eyes looked deeply into mine. "I appreciate your saving me my love. I was foolish to experiment with such magic, without adequate means to handle a problem. I can only imagine what would have happened if you didn't save me. It could have cost me my magical abilities entirely." \n  After a few questions, I learn that she was trying to interpret an arcane tome that she had found. And apparently the magic is meant to strip away one's inhibitions, leaving them filled with lust. Hermione now feels she can do the opposite with her magic, the ability to remove lustful or hedonistic thoughts from a person should I wish it. In fact, she believes she can make a normal person become chaste, and a chaste one celibate. \n  I just need to point her towards the desired target, and if I have the energy (piety) necessary to draw upon, she'll make it happen.;;;;;;;;;;;;;x
dw_wizardtower5252A;I gladly accept your offer of affection my love.;;;;;;;;;;;;;x
dw_wizardtower5252B;I'm sorry Hermione, you're not the woman for me.;;;;;;;;;;;;;x
dw_wizardtower5252C;I'm just thankful that you're well my love.;;;;;;;;;;;;;x
dw_wizardtower5253.0;I watched Hermione squirm within the circle until she convulsed and screamed out as though experiencing an extreme climax. She then collapsed and laid motionless outside of some occasional twitching, so I had her carried to her chambers. \n  It was the evening of the next day when it dawned upon me that I had not heard from her, so I stopped by her room. I found a very unexpected site, as the young wizard was nearly naked upon her bed, knees up and her pussy clearly exposed. Although I stood there in the doorway, she paid me no attention as she focused arcane energies around her swollen mound. \n  "Unh, oh, oh, ah, can't... Can't get enough... Unh, oh..." \n  I watched as Hermione reached a climax that left her panting and near collapse, yet she began flicking her wrist once more to keep the energy swirling about her womanhood. I considered stepping into the room, yet my body seemed hesitant to enter the swirling mystical forces. \n  After watching a little longer, I don't see an end in sight, so I close the door to her room, to leave her alone with her struggle.;;;;;;;;;;;;;x
dw_wizardtower5253.1;I watched Hermione squirm within the circle until she convulsed and screamed out as though experiencing an extreme climax. She then collapsed and laid motionless outside of some occasional twitching, so I picked her up and carried to bed. \n  It was the evening of the next day when it dawned upon me that I had not heard from her, so I stopped by the bedroom to check in upon her. I found a very unexpected site, as my young love was nearly naked upon her bed, knees up and her pussy clearly exposed. Although I stood there in the doorway, she paid me no attention as she focused arcane energies around her swollen mound. \n  "Unh, oh, oh, ah, can't... Can't get enough... Unh, oh..." \n  I watched as Hermione reached a climax that left her panting and near collapse, yet she began flicking her wrist once more to keep the energy swirling about her womanhood. I considered stepping into the room, yet my body seemed hesitant to enter the swirling mystical forces. \n  After watching a little longer, I don't see an end in sight, so I close the door to the room, to leave her alone with her struggle.;;;;;;;;;;;;;x
dw_wizardtower5253A;I appear to have lost my wizard to her carnal desires.;;;;;;;;;;;;;x
dw_wizardtower5253B;It appears my lover has become lost in her lust.;;;;;;;;;;;;;x
dw_wizardtower5254.0;A week has gone by and the Wizard that I originally obtained, is no longer the one who wanders the halls of my estate now. The staff gives her a wide berth, as she's prone to speaking wildly to herself, and getting her to completely cover herself is a chore. \n  Her arcane abilities appear to be stunted, as her body is the only thing she explores with her magic theories. I've consulted the head Wizard at the tower, and he spoke what others suspected. She has been driven mad, and is often consumed by fits of lustful lunacy. Although she does have moments of lucidity, where she can function almost normally. \n  This evening, I find her wandering the halls once more, her clothing not hiding her precious parts. \n  "My [Root.GetLordLady], I've an itch, would you mind helping me scratch it? Just this evening. Plus, I won't bother you with the romantic necessities of a true relationship. I'm just in need of some flesh based stimulus." \n  She's been with several this week, and all of them swore it was a mistake as they say she can't be satisfied.;;;;;;;;;;;;;x
dw_wizardtower5254.1;A week has gone by and my lover, is no longer the one who wanders the halls of my estate now. The staff gives her a wide berth, as she's prone to speaking wildly to herself, and getting her to completely cover herself is a chore. \n  Her arcane abilities appear to be stunted, as her body is the only thing she explores with her magic theories. I've consulted the head Wizard at the tower, and he spoke what others suspected. She has been driven mad, and is often consumed by fits of lustful lunacy. Although she does have moments of lucidity, where she can function almost normally. \n  This evening, I find her wandering the halls once more, her clothing not hiding her precious parts. \n  "My [Root.GetLordLady], I've an itch, would you mind helping me scratch it? Just this evening. Plus, I won't bother you with the romantic necessities of a true relationship. I'm just in need of some flesh based stimulus." \n  I know that she's been with others besides just me this week, and nothing I or her other toys have done has satisfied her so far.;;;;;;;;;;;;;x
dw_wizardtower5254.2;A week has gone by and the woman I married, is no longer the one who wanders the halls of my estate now. The staff gives her a wide berth, as she's prone to speaking wildly to herself, and getting her to completely cover herself is a chore. \n  Her arcane abilities appear to be stunted, as her body is the only thing she explores with her magic theories. I've consulted the head Wizard at the tower, and he spoke what others suspected. She has been driven mad, and is often consumed by fits of lustful lunacy. Although she does have moments of lucidity, where she can function almost normally. \n  This evening, I find her wandering the halls once more, her clothing not hiding her precious parts. \n  "My [Root.GetLordLady], I've an itch, would you mind helping me scratch it? Just this evening. Plus, I won't bother you with the romantic necessities of a true relationship. I'm just in need of some flesh based stimulus." \n  She's been insatiable this week, and I know that she's attempted to seduce others without concern of my thoughts. I've been unable to satisfy her so far, and I know it's only a matter of time before she lays with another, if it hasn't already happened.;;;;;;;;;;;;;x
dw_wizardtower5254A;Yes, I will help you scratch your itch.;;;;;;;;;;;;;x
dw_wizardtower5254B;I think it'd be best to pass for tonight.;;;;;;;;;;;;;x
dw_wizardtower5255;I agree to the offer and she wastes no time, grabbing me by the wrist and dragging me to the nearby bedroom as she tosses off her clothes and hops onto the bed. Looking over her shoulder she mutters something along the lines of 'Lubrioso'. I pause for a second, as I expect something to happen to me. The pause is too long as she moans, 'Noooo, come on. I'm ready for you. No need to be gentle, the spell lubed me.' \n  I drop my pants and pull out my cock, aiming it at her pussy. \n  "No, I need to feel it rougher. Fuck my ass. It's ready. Please, fuck my ass as hard as you want!" \n  I shrug as I line up and push against her asshole. It parts and I sink in smoothly. Her ass is tight, and I can feel it squeezing all around my cock. \n  "Fuck me. Fuck me hard!" \n  Seeing no reason not to oblige, I begin driving it home. Hermione grips the bedding and shoves her body backwards making it a very rough anal fucking. My head's spinning from the sensation, and I smack her ass cheek. She lets out a whimper that turns into a moan, so I give it several more good smacks until her ass is nice and red. \n  Finally, I've reached my peak, she seems to sense it as well as she begins screaming out as I stop moving. She's tossing her ass back on my cock violently all by herself and it sends me over, my cock twitching as I cum inside her ass.;;;;;;;;;;;;;x
dw_wizardtower5255A;While Hermione peaked, she's still frustrated.;;;;;;;;;;;;;x
dw_wizardtower5256;I agree to the offer and Hermione drags me to the nearest room where with a few flicks of her wand, leaves us both undressed. She licks her lips as she looks at me, as though a ravenous person preparing to dig into dinner. \n  "My breasts... 'Expansioso'" A moan escapes Hermione's lips as her breasts enlarge. She pinches a nipple and shudders from the sensation. "Oh fuck, too bad it's only temporary. Now, fuck me. Take me. Please." \n  Hermione gets down on all fours and raises her ass up in the air. I step forward and slap my cock on her ass and give one of her ass cheeks a nice resounding smack. She whimpers and quivers before pushing her hips back, as though hoping to force me into her. \n  I consider teasing her until she locks me with a stern look that I realize could be dangerous while she's still wrestling with these new feelings. \n  I go to slid my cock in her pussy, and she surprisingly drops her hips. "My ass, please... 'Lubrioso'" \n  I pause for a second before pushing my cock against her backdoor. It slides in and we both moan from the sensation. I begin to pound away at her ass, while her enlarged breasts sway beneath her. Soon she's panting and pushing back with such force that I have to brace myself. \n  She erupts, cumming from being taken anally, and her ass contracting around my cock sends me over as well.;;;;;;;;;;;;;x
dw_wizardtower5256A;While Hermione climaxed, she's still frustrated.;;;;;;;;;;;;;x
dw_wizardtower5257;I agree to the offer and Hermione squeals with excitement as she grabs my hand and leads me to the bedroom. She tears my clothes of with such hunger, that I begin to wonder if I made a mistake agreeing to this. \n  As soon as we're both naked, she tackles me, landing on top of me. Hermione is already panting from excitement as she rubs her body on top of mine. Her skin is so soft, and her body is so sensitive to the touch, that I'm able to get some semblance of control by caressing, tugging, kissing, and pushing upon her body until I'm finally on top of her. As soon as I let up though, she regains her strength, making it an odd sensual wrestling match. \n  Hermione is so sensitive that bringing her to a climax isn't too difficult. The hard part is how I can't ease up as she quickly winds back up. And I'm not getting ignored in all of this. I know I've climaxed twice now, but my knees and arms feel weak, my tongue actually aches, and my hips might be bruised from an extreme grinding earlier. \n  After another thirty minutes I can barely keep my eyes open. Hermione appears to be tiring as well, although she can still move. I on the other hand can do little more than lay by her side and place soft kisses upon her breasts. It's been an extreme session, and I cannot wait for sleep to take me.;;;;;;;;;;;;;x
dw_wizardtower5257A;In the end, Hermione is barely sated.;;;;;;;;;;;;;x
dw_wizardtower5260;I'm on the way to my room when I hear a slightly unhinged laugh, which is clearly Hermione. Investigating, I find Hermione covered with sweat and bodily juices as she's straddling a young woman who appears to be completely spent and who's glistening herself from sweat and various juices. \n  "Oh, my liege. Isn't she the cutest morsel? She was so kind in helping me focus. And our little session was so energetic that I've managed to gather our joining to finish off this little love potion. It's yours if you want it. Otherwise I think I'll use it here on my new friend." \n  Curious, I ask Hermione what her potion would do. Apparently, my target would only need to consume the potion and they'd recognize me as their love. It apparently can even loosen the resolve of one who is chaste or swore to celibacy. A powerful potion to be sure. \n  NOTE: Target your desired love to see if you can convince them to drink it.;;;;;;;;;;;;;x
dw_wizardtower5260A;Thank you for the potion Hermione.;;;;;;;;;;;;;x
dw_wizardtower5260B;It's yours to use as you wish Hermione.;;;;;;;;;;;;;x
dw_wizardtower5261.0;I go to visit with [dw_love_potion_target.GetBestName], bringing with me a bottle of their favorite drink. \n  [dw_love_potion_target.GetFirstName] is surprised to see me, yet is welcoming and cordial to the unexpected visit. I inquire as to some cups in order to enjoy the drink I brought. \n  Some cups are brought out, and while maintaining small talk, I pour each of us a drink. The only difference is a little sleight of hand, and I've added the love potion that Hermione gave me to theirs. \n  Cups in hand, our conversation continues and I watch as they take a drink. The effect appears to be almost instant, as the eyes focus upon me, with a whole new hunger to them.;;;;;;;;;;;;;x
dw_wizardtower5261.1;I go to visit with [dw_love_potion_target.GetBestName], bringing with me a bottle of their favorite drink. \n  [dw_love_potion_target.GetFirstName] is surprised to see me, yet is welcoming and cordial to the unexpected visit. I inquire as to some cups in order to enjoy the drink I brought. \n  Some cups are brought out, and while maintaining small talk, I pour each of us a drink. The only difference is a little sleight of hand, and I've added the love potion that Hermione gave me to theirs. \n  Cups in hand, our conversation continues, although I notice for a second that [dw_love_potion_target.GetFirstName] stares momentarily at their cup, as though contemplating something. I try not to tense up as I wait to see if they take a drink.;;;;;;;;;;;;;x
dw_wizardtower5261.2;I go to visit with [dw_love_potion_target.GetBestName], bringing with me a bottle of their favorite drink. \n  [dw_love_potion_target.GetFirstName] is surprised to see me, yet is welcoming and cordial to the unexpected visit. I inquire as to some cups in order to enjoy the drink I brought. \n  Some cups are brought out, and while maintaining small talk, I pour each of us a drink. The only difference is a little sleight of hand, and I've added the love potion that Hermione gave me to theirs. \n  Cups in hand, our conversation continues, although I notice that [dw_love_potion_target.GetFirstName] seems to be staring at me intently, almost as though they're weighing my true intention. Certainly they didn't see me add the love potion to their drink. I try not to tense up as I wait to see if they take a drink.;;;;;;;;;;;;;x
dw_wizardtower5261A;My success is assured.;;;;;;;;;;;;;x
dw_wizardtower5261B;The odds seem to be in my favor.;;;;;;;;;;;;;x
dw_wizardtower5261C;It's a toss up as to whether this will work or not.;;;;;;;;;;;;;x
dw_wizardtower5266;Having allowed Hermione to use her love potion as she pleases, I discover that her selected partner is a young wizard herself named Ginny. \n  I also notice that Ginny is completely smitten by Hermione, and she has trouble keeping her hands to herself when Hermione introduces her to me. Ginny apparently lacks the skill and potential that Hermione has, which is why she was never offered up as a Court Wizard option from the Wizard's Tower.;;;;;;;;;;;;;x
dw_wizardtower5266A;Welcome to my court Ginny.;;;;;;;;;;;;;x
dw_wizardtower5267;Having allowed Hermione to use her love potion as she pleases, I discover that her selected partner is a young wizard herself named Luna. \n  It's a little awkward as I notice Luna muttering to herself as she stares longingly at Hermione. Hermione doesn't seem to notice it at all as she introduces Luna to me. Luna apparently is somewhat insane, which is why she was never offered up as a Court Wizard option from the Wizard's Tower.;;;;;;;;;;;;;x
dw_wizardtower5267A;Welcome to my court Luna.;;;;;;;;;;;;;x
