#CODE;ENGLISH;;;;;;;;;;;;;x
DWWerewolf4050A;While unplanned, it wasn't bad playing a bit.;;;;;;;;;;;;;x
DWWerewolf2310;I must act in order to calm the voice of the beast within, and one thing that the beast regularly calls for is an end to those who threaten me. I'm not without rivals, and tonight, I've decided that [dw_hunt_rival.GetBestName] shall no longer be a thorn in my side. \n  The challenge of course is that as my rival, they're well aware of the threat that I pose and as such will have resources in place to help protect them. Still, my mind is made up, so the only decision to make is how I should go about taking down my rival.;;;;;;;;;;;;;x
DWWerewolf2310A;I shall use diplomatic favors to lure my rival into facing me.;;;;;;;;;;;;;x
DWWerewolf2310B;I shall let nothing stand in my way as I move to face my rival.;;;;;;;;;;;;;x
DWWerewolf2310C;I shall infiltrate and ambush my rival.;;;;;;;;;;;;;x
DWWerewolf2310D;I shall end this rivalry to the best of my ability.;;;;;;;;;;;;;x
DWWerewolf2390;I'd like to say that my rival was a worthy opponent, however, I walk away from this unscathed and disappointed that such a weakling would dare consider to make themselves an enemy of me. The beast within though is satisfied in having a known threat dealt with. \n  Giving one last look to the mangled body that was a rival, I snort in disgust before bounding away into the night.;;;;;;;;;;;;;x
DWWerewolf2390A;[dw_hunt_rival.GetBestName] is a threat no longer.;;;;;;;;;;;;;x
DWWerewolf2391;My rival turned out to be a worthy opponent. While they have died by my own hands, [dw_hunt_rival.GetBestName] managed to wound me during the assault. The beast within is also satisfied in having a known threat dealt with. \n  Giving one last look to the mangled body that was a rival, I give a howl of admiration before bounding away into the night.;;;;;;;;;;;;;x
DWWerewolf2391A;[dw_hunt_rival.GetBestName] is a threat no longer.;;;;;;;;;;;;;x
DWWerewolf2392;My rival turned out to almost be more than I could handle. While they have died by my own hands, [dw_hunt_rival.GetBestName] managed to maim me during the assault. The beast within is also satisfied from both the battle and knowing a threat has been dealt with. \n  Giving one last look to the mangled body that was a rival, I give a howl of admiration before dragging my broken body away into the night.;;;;;;;;;;;;;x
DWWerewolf2392A;[dw_hunt_rival.GetBestName] is a threat no longer.;;;;;;;;;;;;;x
DWWerewolf2399;I underestimated my rival. I was certain that the time to strike them was clearly in my favor, and that I had the skill to come out on top. Alas, it is their blade that brings an end to my life.;;;;;;;;;;;;;x
DWWerewolf2399A;May they burn in hell.;;;;;;;;;;;;;x
#### Rough text length for using narrative events ###############################################################################################################################################################################################################################################################################################################################################################################################################################################################################################################################################################################################################################################################################################################################################################################################################################